{
  "job_name": "1a9n",
  "recycle": 10,
  "ensemble": 30,
  "entities": [
    {
      "type": "protein",
      "sequence": "MVKLTAELIEQAAQYTNAVRDRELDLRGYKIPVIENLGATLDQFDAIDFSDNEIRKLDGFPLLRRLKTLLVNNNRICRIGEGLDQALPDLTELILTNNSLVELGDLDPLASLKSLTYLCILRNPVTNKKHYRLYVIYKVPQVRVLDFQKVKLKERQEAEKMFKGKRGAQLAKDIAR",
      "count": 1
    },
    {
      "type": "protein",
      "sequence": "MDIRPNHTIYINNMNDKIKKEELKRSLYALFSQFGHVVDIVALKTMKMRGQAFVIFKELGSSTNALRQLQGFPFYGKPMRIQYAKTDSDIISKMRG",
      "count": 1
    },
    {
      "type": "rna",
      "sequence": "CCUGGUAUUGCAGUACCUCCAGGU",
      "count": 1
    }
  ],
  "model_type": "HelixFold-S1"
}
