{
  "job_name": "6zcy_smiles",
  "recycle": 10,
  "ensemble": 30,
  "entities": [
    {
      "type": "protein",
      "sequence": "MDTEVYESPYADPEEIRPKEVYLDRKLLTLEDKELGSGNFGTVKKGYYQMKKVVKTVAVKILKNEANDPALKDELLAEANVMQQLDNPYIVRMIGICEAESWMLVMEMAELGPLNKYLQQNRHVKDKNIIELVHQVSMGMKYLEESNFVHRDLAARNVLLVTQHYAKISDFGLSKALRADENYYKAQTHGKWPVKWYAPECINYYKFSSKSDVWSFGVLMWEAFSYGQKPYRGMKGSEVTAMLEKGERMGCPAGCPREMYDLMNLCWTYDVENRPGFAAVELRLRNYYYDVVNHHHHHH",
      "count": 1
    },
    {
      "type": "ligand",
      "smiles": "CNC(=O)c1nn(C)c2ccc(Nc3nccc(n3)n4cc(N[C@@H]5CCNC5)c(C)n4)cc12",
      "count": 1
    }
  ],
  "model_type": "HelixFold-S1"
}
