{
  "job_name": "6zcy",
  "recycle": 10,
  "ensemble": 30,
  "entities": [
    {
      "type": "protein",
      "sequence": "MDTEVYESPYADPEEIRPKEVYLDRKLLTLEDKELGSGNFGTVKKGYYQMKKVVKTVAVKILKNEANDPALKDELLAEANVMQQLDNPYIVRMIGICEAESWMLVMEMAELGPLNKYLQQNRHVKDKNIIELVHQVSMGMKYLEESNFVHRDLAARNVLLVTQHYAKISDFGLSKALRADENYYKAQTHGKWPVKWYAPECINYYKFSSKSDVWSFGVLMWEAFSYGQKPYRGMKGSEVTAMLEKGERMGCPAGCPREMYDLMNLCWTYDVENRPGFAAVELRLRNYYYDVVNHHHHHH",
      "count": 1
    },
    {
      "type": "ligand",
      "ccd": "QF8",
      "count": 1
    }
  ],
  "model_type": "HelixFold-S1"
}
